{
  "$schema": "http://json-schema.org/draft-07/schema#",
  "title": "Question Schema",
  "description": "Schema for defining questions in a form.",
  "type": "object",
  "properties": {
    "id": {
      "type": "string",
      "description": "Unique identifier for the question."
    },
    "key": {
      "type": "string",
      "description": "Key used to reference this question."
    },
    "label": {
      "type": "string",
      "description": "Label displayed for the question."
    },
    "type": {
      "type": "string",
      "enum": ["text", "number", "yes_no", "dropdown", "radio", "checkbox", "multiselect"],
      "description": "Type of input field (e.g., text, dropdown)."
    },
    "placeholder": {
      "type": "string",
      "description": "Placeholder text for the input field."
    },
    "defaultValue": {
      "description": "Default value for the question."
    },
    "visibleIf": {
      "type": "object",
      "properties": {
        "key": { "type": "string" },
        "equals": { "type": "boolean" }
      },
      "required": ["key", "equals"]
    },
    "options": {
      "type": "array",
      "items": {
        "type": "object",
        "properties": {
          "value": { "type": "string" },
          "label": { "type": "string" }
        },
        "required": ["value", "label"]
      }
    },
    "validation": {
      "type": "object",
      "description": "Validation rules for the question.",
      "properties": {
        "min_length": { "type": "integer" },
        "max_length": { "type": "integer" }
      }
    },
    "helpText": {
      "type": "string",
      "description": "Optional guidance for the user."
    }
  },
  "required": ["id", "key", "label", "type"],
  "if": {
    "properties": { "type": { "enum": ["dropdown", "radio", "checkbox", "multiselect"] } },
    "required": ["type"]
  },
  "then": {
    "required": ["options"]
  }
}
